{
  "$schema": "../../schema/map-semantics.schema.json",
  "schema_version": "1.0.0",
  "map_id": "home",
  "coordinate_system": {
    "origin": "top_left",
    "x_direction": "right",
    "y_direction": "down",
    "units": "pixels_with_tile_companions",
    "rectangle_rule": "left/top inclusive; right/bottom exclusive"
  },
  "map_dimensions": {
    "tiles": {
      "width": 28,
      "height": 43
    },
    "pixels": {
      "width": 896,
      "height": 1376
    },
    "tile_size_px": 32,
    "world_scale": 1
  },
  "day_night_contract": "shared_geometry",
  "movement_resolution": {
    "rule": "walkable_regions union, minus blocked_regions, then passable_overrides",
    "tile_grid_companion": "collision_grid.json",
    "runtime_note": "Vector regions are authoritative; the grid is a deterministic 32px implementation companion."
  },
  "walkable_regions": [
    {
      "id": "walk_main_room",
      "shape": "rect",
      "tile_rect": {
        "x": 2,
        "y": 18,
        "width": 24,
        "height": 20
      },
      "pixel_rect": {
        "x": 64,
        "y": 576,
        "width": 768,
        "height": 640
      },
      "surface": "wood_floor"
    },
    {
      "id": "walk_bedroom",
      "shape": "rect",
      "tile_rect": {
        "x": 13,
        "y": 2,
        "width": 12,
        "height": 12
      },
      "pixel_rect": {
        "x": 416,
        "y": 64,
        "width": 384,
        "height": 384
      },
      "surface": "wood_floor"
    },
    {
      "id": "walk_bedroom_connector",
      "shape": "rect",
      "tile_rect": {
        "x": 14,
        "y": 13,
        "width": 3,
        "height": 5
      },
      "pixel_rect": {
        "x": 448,
        "y": 416,
        "width": 96,
        "height": 160
      },
      "surface": "wood_floor"
    },
    {
      "id": "walk_bottom_sliding_door_floor",
      "shape": "rect",
      "tile_rect": {
        "x": 12,
        "y": 38,
        "width": 4,
        "height": 3
      },
      "pixel_rect": {
        "x": 384,
        "y": 1216,
        "width": 128,
        "height": 96
      },
      "surface": "wood_floor"
    },
    {
      "id": "walk_top_left_entry",
      "shape": "rect",
      "tile_rect": {
        "x": 5,
        "y": 16,
        "width": 3,
        "height": 3
      },
      "pixel_rect": {
        "x": 160,
        "y": 512,
        "width": 96,
        "height": 96
      },
      "surface": "threshold"
    }
  ],
  "blocked_regions": [
    {
      "id": "bed",
      "shape": "rect",
      "tile_rect": {
        "x": 17,
        "y": 5,
        "width": 4,
        "height": 7
      },
      "pixel_rect": {
        "x": 544,
        "y": 160,
        "width": 128,
        "height": 224
      },
      "category": "furniture",
      "object_id": "object_bed"
    },
    {
      "id": "nightstand",
      "shape": "rect",
      "tile_rect": {
        "x": 15,
        "y": 4,
        "width": 2,
        "height": 3
      },
      "pixel_rect": {
        "x": 480,
        "y": 128,
        "width": 64,
        "height": 96
      },
      "category": "furniture"
    },
    {
      "id": "bedroom_bookcase",
      "shape": "rect",
      "tile_rect": {
        "x": 23,
        "y": 4,
        "width": 3,
        "height": 7
      },
      "pixel_rect": {
        "x": 736,
        "y": 128,
        "width": 96,
        "height": 224
      },
      "category": "furniture"
    },
    {
      "id": "living_sofa",
      "shape": "rect",
      "tile_rect": {
        "x": 2,
        "y": 23,
        "width": 4,
        "height": 8
      },
      "pixel_rect": {
        "x": 64,
        "y": 736,
        "width": 128,
        "height": 256
      },
      "category": "furniture"
    },
    {
      "id": "living_coffee_table",
      "shape": "rect",
      "tile_rect": {
        "x": 6,
        "y": 24,
        "width": 2,
        "height": 6
      },
      "pixel_rect": {
        "x": 192,
        "y": 768,
        "width": 64,
        "height": 192
      },
      "category": "furniture"
    },
    {
      "id": "central_shelf",
      "shape": "rect",
      "tile_rect": {
        "x": 10,
        "y": 18,
        "width": 3,
        "height": 9
      },
      "pixel_rect": {
        "x": 320,
        "y": 576,
        "width": 96,
        "height": 288
      },
      "category": "furniture"
    },
    {
      "id": "kitchen_counter",
      "shape": "rect",
      "tile_rect": {
        "x": 17,
        "y": 16,
        "width": 9,
        "height": 5
      },
      "pixel_rect": {
        "x": 544,
        "y": 512,
        "width": 288,
        "height": 160
      },
      "category": "counter"
    },
    {
      "id": "kitchen_appliances",
      "shape": "rect",
      "tile_rect": {
        "x": 20,
        "y": 21,
        "width": 6,
        "height": 6
      },
      "pixel_rect": {
        "x": 640,
        "y": 672,
        "width": 192,
        "height": 192
      },
      "category": "appliance",
      "object_id": "object_refrigerator"
    },
    {
      "id": "kitchen_lower_cabinets",
      "shape": "rect",
      "tile_rect": {
        "x": 17,
        "y": 21,
        "width": 3,
        "height": 6
      },
      "pixel_rect": {
        "x": 544,
        "y": 672,
        "width": 96,
        "height": 192
      },
      "category": "counter"
    },
    {
      "id": "right_pantry",
      "shape": "rect",
      "tile_rect": {
        "x": 23,
        "y": 28,
        "width": 3,
        "height": 9
      },
      "pixel_rect": {
        "x": 736,
        "y": 896,
        "width": 96,
        "height": 288
      },
      "category": "furniture"
    },
    {
      "id": "dining_set",
      "shape": "rect",
      "tile_rect": {
        "x": 11,
        "y": 31,
        "width": 8,
        "height": 6
      },
      "pixel_rect": {
        "x": 352,
        "y": 992,
        "width": 256,
        "height": 192
      },
      "category": "furniture"
    },
    {
      "id": "dog_bed",
      "shape": "rect",
      "tile_rect": {
        "x": 2,
        "y": 35,
        "width": 3,
        "height": 3
      },
      "pixel_rect": {
        "x": 64,
        "y": 1120,
        "width": 96,
        "height": 96
      },
      "category": "pet_furniture"
    },
    {
      "id": "entry_left_plant",
      "shape": "rect",
      "tile_rect": {
        "x": 4,
        "y": 39,
        "width": 2,
        "height": 2
      },
      "pixel_rect": {
        "x": 128,
        "y": 1248,
        "width": 64,
        "height": 64
      },
      "category": "plant"
    },
    {
      "id": "entry_right_plant",
      "shape": "rect",
      "tile_rect": {
        "x": 23,
        "y": 39,
        "width": 2,
        "height": 2
      },
      "pixel_rect": {
        "x": 736,
        "y": 1248,
        "width": 64,
        "height": 64
      },
      "category": "plant"
    }
  ],
  "passable_overrides": [
    {
      "id": "bedroom_connector_clear",
      "shape": "rect",
      "tile_rect": {
        "x": 14,
        "y": 13,
        "width": 3,
        "height": 5
      },
      "pixel_rect": {
        "x": 448,
        "y": 416,
        "width": 96,
        "height": 160
      },
      "purpose": "corridor"
    },
    {
      "id": "bottom_sliding_door_floor_clear",
      "shape": "rect",
      "tile_rect": {
        "x": 12,
        "y": 38,
        "width": 4,
        "height": 3
      },
      "pixel_rect": {
        "x": 384,
        "y": 1216,
        "width": 128,
        "height": 96
      },
      "purpose": "walkable_sliding_door_floor"
    },
    {
      "id": "top_left_entry_clear",
      "shape": "rect",
      "tile_rect": {
        "x": 5,
        "y": 16,
        "width": 3,
        "height": 3
      },
      "pixel_rect": {
        "x": 160,
        "y": 512,
        "width": 96,
        "height": 96
      },
      "purpose": "door_threshold"
    }
  ],
  "structures": [
    {
      "id": "structure_home_shell",
      "shape": "rect",
      "tile_rect": {
        "x": 2,
        "y": 1,
        "width": 25,
        "height": 40
      },
      "pixel_rect": {
        "x": 64,
        "y": 32,
        "width": 800,
        "height": 1280
      },
      "name": "Lulu's home interior",
      "entry_door_id": "door_home_exit"
    }
  ],
  "objects": [
    {
      "id": "object_bed",
      "shape": "rect",
      "tile_rect": {
        "x": 17,
        "y": 5,
        "width": 4,
        "height": 7
      },
      "pixel_rect": {
        "x": 544,
        "y": 160,
        "width": 128,
        "height": 224
      },
      "category": "bed",
      "interaction_id": "interaction_bed"
    },
    {
      "id": "object_refrigerator",
      "shape": "rect",
      "tile_rect": {
        "x": 23,
        "y": 22,
        "width": 3,
        "height": 6
      },
      "pixel_rect": {
        "x": 736,
        "y": 704,
        "width": 96,
        "height": 192
      },
      "category": "appliance",
      "interaction_id": "interaction_refrigerator"
    },
    {
      "id": "object_sofa",
      "shape": "rect",
      "tile_rect": {
        "x": 2,
        "y": 23,
        "width": 4,
        "height": 8
      },
      "pixel_rect": {
        "x": 64,
        "y": 736,
        "width": 128,
        "height": 256
      },
      "category": "sofa"
    },
    {
      "id": "object_dining_set",
      "shape": "rect",
      "tile_rect": {
        "x": 11,
        "y": 31,
        "width": 8,
        "height": 6
      },
      "pixel_rect": {
        "x": 352,
        "y": 992,
        "width": 256,
        "height": 192
      },
      "category": "dining"
    }
  ],
  "doors": [
    {
      "id": "door_home_exit",
      "shape": "rect",
      "tile_rect": {
        "x": 5,
        "y": 17,
        "width": 3,
        "height": 2
      },
      "pixel_rect": {
        "x": 160,
        "y": 544,
        "width": 96,
        "height": 64
      },
      "structure_id": "structure_home_shell",
      "clear_width_px": 96,